{
  "$schema": "./registry.schema.json",
  "version": "3.0.0",
  "lastUpdated": "2025-11-19T18:20:06.721Z",
  "primitives": {
    "browser": {
      "description": "Atomic browser operations",
      "tools": [
        {
          "id": "browser.close",
          "category": "browser",
          "capabilities": [
            "close"
          ],
          "when": "Close the browser instance or specific tab",
          "flags": [
            "tab-only"
          ],
          "example": "* node close.js --param value",
          "path": "capabilities/primitives/browser/close.js"
        },
        {
          "id": "browser.cookies",
          "category": "browser",
          "capabilities": [
            "cookies"
          ],
          "when": "Get or set browser cookies",
          "flags": [
            "get",
            "set",
            "name",
            "value",
            "domain"
          ],
          "example": "* node cookies.js --param value",
          "path": "capabilities/primitives/browser/cookies.js"
        },
        {
          "id": "browser.eval",
          "category": "browser",
          "capabilities": [
            "eval"
          ],
          "when": "Execute JavaScript code in browser context",
          "flags": [
            "code"
          ],
          "example": "* node eval.js --param value",
          "path": "capabilities/primitives/browser/eval.js"
        },
        {
          "id": "browser.navigate",
          "category": "browser",
          "capabilities": [
            "navigate"
          ],
          "when": "Navigate to a URL in the current or new tab",
          "flags": [
            "url",
            "new-tab",
            "wait-until"
          ],
          "example": "* node navigate.js --param value",
          "path": "capabilities/primitives/browser/navigate.js"
        },
        {
          "id": "browser.start",
          "category": "browser",
          "capabilities": [
            "start"
          ],
          "when": "Launch Chrome with debugging enabled",
          "flags": [
            "param"
          ],
          "example": "* node start.js --param value",
          "path": "capabilities/primitives/browser/start.js"
        }
      ]
    },
    "file": {
      "description": "Atomic file operations",
      "tools": [
        {
          "id": "file.parse-json",
          "category": "file",
          "capabilities": [
            "parse-json"
          ],
          "when": "Read and parse JSON file",
          "flags": [
            "path"
          ],
          "example": "* node parse-json.js --param value",
          "path": "capabilities/primitives/file/parse-json.js"
        },
        {
          "id": "file.read",
          "category": "file",
          "capabilities": [
            "read"
          ],
          "when": "Read file contents",
          "flags": [
            "path",
            "encoding"
          ],
          "example": "* node read.js --param value",
          "path": "capabilities/primitives/file/read.js"
        },
        {
          "id": "file.write",
          "category": "file",
          "capabilities": [
            "write"
          ],
          "when": "Write content to file",
          "flags": [
            "path",
            "content",
            "encoding",
            "append"
          ],
          "example": "* node write.js --param value",
          "path": "capabilities/primitives/file/write.js"
        }
      ]
    },
    "http": {
      "description": "Atomic http operations",
      "tools": [
        {
          "id": "http.download",
          "category": "http",
          "capabilities": [
            "download"
          ],
          "when": "Download file from HTTP/HTTPS URL",
          "flags": [
            "url",
            "output",
            "timeout"
          ],
          "example": "* node download.js --param value",
          "path": "capabilities/primitives/http/download.js"
        },
        {
          "id": "http.get",
          "category": "http",
          "capabilities": [
            "get"
          ],
          "when": "Make HTTP GET request",
          "flags": [
            "url",
            "headers",
            "timeout"
          ],
          "example": "* node get.js --param value",
          "path": "capabilities/primitives/http/get.js"
        },
        {
          "id": "http.post",
          "category": "http",
          "capabilities": [
            "post"
          ],
          "when": "Make HTTP POST request",
          "flags": [
            "url",
            "data",
            "headers",
            "timeout"
          ],
          "example": "* node post.js --param value",
          "path": "capabilities/primitives/http/post.js"
        }
      ]
    },
    "instagram": {
      "description": "Atomic instagram operations",
      "tools": [
        {
          "id": "instagram.download-video",
          "category": "instagram",
          "capabilities": [
            "download-video"
          ],
          "when": "Download video or audio from Instagram post/reel URL using yt-dlp",
          "flags": [
            "url",
            "output",
            "cookies",
            "quality",
            "audio-only"
          ],
          "example": "* node download-video.js --param value",
          "path": "capabilities/primitives/instagram/download-video.js"
        }
      ]
    },
    "media": {
      "description": "Atomic media operations",
      "tools": [
        {
          "id": "media.analyze-image",
          "description": "Save image metadata and create analysis queue for Claude Code agent processing (zero-cost)",
          "category": "media",
          "inputs": [
            "input",
            "queue-file"
          ],
          "outputs": [
            "queued",
            "queueFile",
            "imageInfo"
          ],
          "capabilities": [
            "analyze-image"
          ],
          "example": "* node media/analyze-image.js --input /path/to/image.jpg",
          "path": "capabilities/primitives/media/analyze-image.js"
        },
        {
          "id": "media.convert",
          "category": "media",
          "capabilities": [
            "convert"
          ],
          "when": "Convert video between formats",
          "flags": [
            "input",
            "output",
            "format",
            "codec",
            "preset",
            "bitrate"
          ],
          "example": "* node convert.js --param value",
          "path": "capabilities/primitives/media/convert.js"
        },
        {
          "id": "media.extract-audio",
          "category": "media",
          "capabilities": [
            "extract-audio"
          ],
          "when": "Extract audio track from video file",
          "flags": [
            "input",
            "output",
            "format",
            "quality"
          ],
          "example": "* node extract-audio.js --param value",
          "path": "capabilities/primitives/media/extract-audio.js"
        },
        {
          "id": "media.ocr-image",
          "description": "Extract text from images using Tesseract OCR (free, local, zero-cost)",
          "category": "media",
          "inputs": [
            "input",
            "output",
            "language"
          ],
          "outputs": [
            "text",
            "success"
          ],
          "capabilities": [
            "ocr-image"
          ],
          "systemDependencies": [
            "tesseract"
          ],
          "example": "* node media/ocr-image.js --input /path/to/image.jpg",
          "path": "capabilities/primitives/media/ocr-image.js"
        },
        {
          "id": "media.transcribe-segments",
          "description": "Transcribe video with timestamps in specific time segments using whisper.cpp (free, local, zero-cost)",
          "category": "media",
          "inputs": [
            "input",
            "segments",
            "output",
            "language",
            "model"
          ],
          "outputs": [
            "segments",
            "success"
          ],
          "capabilities": [
            "transcribe-segments"
          ],
          "systemDependencies": [
            "ffmpeg",
            "whisper.cpp"
          ],
          "example": "* node media/transcribe-segments.js --input /path/to/video.mp4 --segments \"0-3,3-10,10+\"",
          "path": "capabilities/primitives/media/transcribe-segments.js"
        },
        {
          "id": "media.transcribe",
          "category": "media",
          "capabilities": [
            "transcribe"
          ],
          "when": "Transcribe audio/video file using whisper.cpp (free, local, zero-cost)",
          "flags": [
            "input",
            "output",
            "language",
            "format",
            "model"
          ],
          "example": "* node transcribe.js --param value",
          "path": "capabilities/primitives/media/transcribe.js"
        }
      ]
    },
    "page": {
      "description": "Atomic page operations",
      "tools": [
        {
          "id": "page.click",
          "category": "page",
          "capabilities": [
            "click"
          ],
          "when": "Click an element by CSS selector",
          "flags": [
            "selector",
            "wait"
          ],
          "example": "* node click.js --param value",
          "path": "capabilities/primitives/page/click.js"
        },
        {
          "id": "page.extract-html",
          "category": "page",
          "capabilities": [
            "extract-html"
          ],
          "when": "Extract HTML content from CSS selector",
          "flags": [
            "selector",
            "all",
            "outer"
          ],
          "example": "* node extract-html.js --param value",
          "path": "capabilities/primitives/page/extract-html.js"
        },
        {